question,choices,answer
A man and a woman wearing roller blades kneel facing each other on a basketball court. A dog runs by the man and woman. The man and woman rise together. the man and woman,"['perform a paired roller blade routine.' 'swing the blades together.'
 'break apart and hug.' 'repeat at the end.']",@
"[header] How to do headband curls [title] Brush your hair. [step] Before you dive into making your headband curls, brush or comb your hair to remove knots. Brush or comb the tips of your hair, then hold the brush an inch or so higher and brush down through your hair.","[""Use short strokes, about one to two inches, on your hair. [substeps] When you're styling your hair, it's best to brush it out first.""
 ""When you're finished, it should feel soft and silky under your fingers. [substeps] Don't like the length? Leave about ½ to ¾ of a-half inch of hair to span between your brows.""
 'Keep working your way up your head, brushing in downward motions, until you reach the top of your head. [substeps] Having knotted hair will make doing this hairstyle harder, and it will make your curls less defined.'
 'Comb the hair as you brush to dislodge any knots. [substeps] If you have very coarse hair, you can skip this step.']",B
"[header] How to take care of your lash extensions [title] Arrive to your appointment with clean eyes. [step] Be sure that your lashes are free of any makeup and/or oily residue. Not only does this speed up the application time, the adhesive will stick better to clean lashes [title] After each application, whether it be your first full set of lashes or a refill, avoid getting your lashes wet for at least 48hrs.","['[step] This can make bacteria or other conditions worse. [title] Use a regular moisturizing cleanser, avoid using an anti-waterproof moisturizer which may cause irritation or other problems.'
 '[step] This means shower before your appointment and/or wash your hair & body separately. [title] For 48hrs after your application, you should also avoid steam.'
 '[step] They should be very gentle and come out smooth. [title] Apply brush or concealer (optional) to your lashes to ensure that they are blended in properly.'
 '[title] When you get to the appointment, wash your face with a soft cleanser (optional). [step] Use eye drops that have antibacterial/antimicrobial properties.']",A
[header] How to rag paint a wall [title] Prepare the room where you will be painting by removing all furniture (if possible) and other obstacles. [step] It's important in the process of knowing how to rag paint a wall to have a clear work area. [title] Cover the floor and any large furniture (like couches) that cannot be removed from the room with plastic drop cloths.,"['[title] Start by lining up your work area. [step] Find a solid, level surface like wood, concrete, or asphalt or underneath some tarp.'
 '[step] These are the spots you are painting that would likely not be visible on a regular wall of your studio, or a family room. [title] Place other drop cloths over large furniture (like chairs).'
 ""[title] Mark the area you'll be painting on with painter's tape. [step] This will help you to mark any curved edges later on on.""
 '[title] Tape edges of the areas you do not wish to be painted to protect the areas from paint splatters and brush edges. [title] Pour paint for the base color into a paint tray.']",C
"[header] How to choose and wear cologne [title] Wear cologne with oriental or wood notes in the fall and winter. [step] You can choose to wear cologne with the seasons by avoiding light and floral scents in the cold months and instead wearing earthy colognes like sandalwood, cedar, and vetiver to complement the weather. [title] Choose a cologne with floral and fresh notes in the spring and summer.","['[step] The musky scent of wood will pair better with flowers, oils, and gels. [title] Choose a cologne with a classic or vintage appearance.'
 '[step] As the weather gets warmer, wear cologne that enhances the season. Floral, fruity, green, water, and citrus scented colognes are great for the warmer months.'
 '[step] You can choose to wear your cologne with any time of the month and on any day of the month. Whether you wear it during spring or summer will depend on the season.'
 '[step] Off season perfumes have floral and fresh notes throughout a season. Choose a cologne with floral and fresh notes at every season to help preserve and cover its aroma.']",A
"[header] How to limit your toddler's sugar intake [title] Remove junk food from the house. [step] One way to limit the amount of sugar your toddler eats is to keep all junk food out of the house. Your child won't have access to them, so eventually they will be less likely to ask for them if they are not around and they don't see them.","[""Focus on limiting their junk foods, and raising your child as a parent. [substeps] Keep cookies, cakes, and cupcakes out of your toddler's room during the day.""
 '[substeps] When the sugar dish is full, ask your child why it is being served in the house. And try to put it into the refrigerator as soon as possible.'
 ""It can be helpful to keep the refrigerator full of your child's favorites. Just make sure the containers are in a neat and secure location.""
 '[substeps] Designate a cheat day for your toddler, where they get treats they like. This can be a weekend day, like a saturday, or an after dinner treat.']",C
"[header] How to clean dress shoes [title] Brush or wipe away surface dirt and debris. [step] Use the horsehair brush that comes with many shoe cleaning kits, or another soft-bristled brush. Alternatively, you can use a piece of clean, soft, lint-free cloth, like a strip of an old t-shirt.","['Brush any sections of the shoe all over until you have dusted the shoe with a vacuum or soft-bristled brush. [title] Wash the entire shoe with soapy water.'
 '[substeps] The more often you do this basic surface cleaning-e.g., every time you take the shoes off-the easier it and the rest of the cleaning process will be. Save your old t-shirts for shoe cleaning and polishing.'
 ""Use the toothbrush to gently sweep away any dirt and debris that forms on the shoes. [substeps] It's important to treat surface dirt underneath the shoes; it could be there as well, but could also be some natural debris! [title] Scrub the shoes down.""
 'Brush or wipe away dirt using a soft cloth or dustpan. [substeps] Some places you can brush dirt with the horsehair brush might be between floor boards or carpet, as well as around the door knobs.']",A
[header] How to clean a drain pipe [title] Bring two liters of water to a rolling boil. [step] Measure two liters (8 cups) of water and pour it into a pot and place it over your stovetop. Turn the stove to high until the water starts to bubble.,"['Bring the water to a boil over medium-high heat. [title] Turn on the burner to high heat.'
 '[substeps] You can also use a kettle or electric water heater to heat up the water. [title] Add dishwashing detergent to the water.'
 'Once the water begins foaming, turn the heat down to medium-low and wait for the water to boil. [substeps] You may be able to find a rolling boil setting at most hardware stores.'
 'Then add two liters (8 liters) of nitrate and allow the water to boil for 5 minutes. [substeps] Inside you can check the water periodically with a flathead thermometer to determine its nitrate levels.']",A
[header] How to make hair color fade [title] Crush vitamin c tablets. [step] Vitamin c contains an acid that is capable of breaking down the chemical composition of hair dye. This method will lighten your hair 1 to 2 shades.,"['Use a candy crush, the kernel of a citrus fruit or a centrifuge to crush vitamin c tablets into a powder. Apply the powder to affected hair and let sit for 1 hour before rinsing.'
 ""Treating your dyed hair with a vitamin c powder infused shampoo will fade the color. If you don't have a powdered form of vitamin c, crush or grind vitamin c tablets into a fine powder.""
 '[substeps] Crush the vitamin c tablets directly into a bowl of water. Soak them in the water for 2 to 3 minutes until there is no blood.'
 'Taking 20 to 30 vitamin c tablets daily will help you achieve your desired color, but how you crush them is completely up to you. [substeps] Mix 10-15 drops of vitamin c tablets into 1 quart of water.']",A
"[header] How to shrink leather shoes [title] Be cautious when using this method. [step] Water has the potential to damage leather, and if you use too much your shoe may become stiff, stained, or cracked. Optionally, you may apply a leather guard or leather protector solution to the surface you plan on treating, but this may make the shoe more resistant to water treatment.","['[substeps] Be careful when using this method with your sneakers. They may not last as long, and it may take a few hard tries to get them to fit properly.'
 '[substeps] Leather guards may react easily to the water-based treatment, or you may increase the effectiveness by using a rubber or nylon moisturizer. [title] Find a place in your home to be patient.'
 '[substeps] If you want to add moisture to your shoe or the surface, be sure to only apply this treatment to the wet part of the shoe. [title] Rub the sole with an oil-based cleaner.'
 '[substeps] If you do apply leather guard to your shoe, allow it to dry completely before you continue. [title] Get the sides or top of the shoe damp.']",C
"[header] How to reset a water heater [title] Disconnect the electricity to the heater. [step] Never tamper with a water heater that's still powered on. Before you begin opening the heater, figure out where it's plugged into the wall and turn off the electricity.","['[substeps] Most heaters are plugged into a wall with a cable. You may have to unscrew the cable or turn a knob near it to shut off the electricity.'
 '[substeps] The water heater is usually located off from the main unit. [title] Look inside the heater housing to determine if there is a plug-in/battery-operated wall thermometer.'
 '[substeps] Typically there are a series of holes in the wall and a "" charge "" button at the bottom of the water heater. Check the circuit and ensure that the "" charge "" button is turned off.'
 'Water aways often have a hot current running through them. If your running water heater is plugged in, this inputs the electricity into a water supply, whose cord may be plugged in on other appliances.']",@
"[header] How to buy a timeshare [title] Choose deeded ownership to own part of the unit. [step] With this type of timeshare, you buy a certain time period each year in the vacation unit. You are actually part owner of the property, so you can rent it or even include it in your will to pass on to someone else.","['This way the potential owners can extend the timeshare for several years, usually within the designated timeshare year. [substeps] The deeded share should be classified as a sole proprietorship or llc.'
 '[substeps] The downside is you can only use the unit at the specified time each year, unless you are able to trade with another timeshare holder. [title] Pick the "" right-to-use "" option for more flexibility.'
 '[substeps] Deeded ownership is typically sent to you as a gift. You actually buy a portion of the time period for someone else, and then allow them to take over the rest of the time period.'
 'This type of timeshare is essentially the same as the car. You can purchase it for a certain price, such as 25%, as long as the dmv availability is essential.']",A
"[header] How to address a business envelope effectively [title] Select plain colored envelopes. [step] Avoid using fancy envelopes when it concerns a business transaction, or any other official transaction such as writing to government or a court. [title] Use black or blue pen only.","['[step] Use grey or silver ink depending on your business establishment. [substeps] Colors that are misrepresented may create the impression of malicious intent.'
 '[step] The prospective mailers will not read the envelope. Doing so will make it look unprofessional and ill-conceived.'
 ""[step] Stick with the regulation pens if you are writing directly onto the envelope. Other colors are distracting and suggest a lack of professionalism that can hold things up in someone's in-tray.""
 '[step] This is too elegant and makes it confusing for the recipient of a business envelope even more. Gray or black ink can easily create smudges or look glossy.']",B
"[header] How to insert a video link in constant contact [title] Visit the constantcontact website. [title] Click the "" log in "" button in the top right hand corner of the page. [title] Enter the user name and password associated with your constant contact account and click "" login "".","['[step] You will be taken immediately to the "" home "" tab of your account page. [title] Select the edit icon next to the email you want to insert a video link in.'
 '[title] Follow the on-screen prompts to complete the blank page and link your video to the website. [title] Click the "" continue "" button to continue to the page.'
 '[title] Click the "" friends "" dropdown list. [step] If you don\'t have any friends on constantcontact, you will have to make another visit.'
 '[title] Click the "" deactivate "" button at the top right hand corner of the page. [step] As with the other website applications, such as google adisco.com, you are asked to confirm that you want to deactivate your web account.']",@
"[header] How to clean snow peas [title] Choose healthy peas. [step] A mature snow pea can be up to 3 inches in length. Select ones with smooth, not wrinkly, skin.","['They should have a solid green skin free of any cracks. The pods should be fairly flat, indicating small sized peas.'
 '[substeps] Pick 1 large, round seed and 1 medium one. You can harvest it fairly easily, but this is not necessary to make an adult snow pea.'
 '[substeps] This step goes for peas that have burrs; white-annical peas tend to be the exception. Brown colored peas use 100% return bleach, even if they are very dirty.'
 'Avoid peas whose outer coat has become leathery and dry. Protective outdoor materials like plastic cover are a good option.']",@
"[header] How to administer shots to dogs [title] Review the release forms. [step] When you purchase vaccinations or other medicines from a veterinarian to administer yourself, you will have to sign a release form. Read this form carefully.","['Make sure to identify the type of medication, whether or not it is nonprescription, and the dosage you are giving your dog. [substeps] The release form should contain the names of high dose doses (2 to 5 ml) or between 15 to 30 mg/kg tablets.'
 ""These forms include important information about your pet's health history, including when the vaccine began and where it was administered. You will also have to sign your medical papers.""
 'It will tell you exactly what kind of medication to give and if you will need any special treatment. The form can include things like vaccinations, shots for engagement with particular breeds, or antibiotics or corticosteroids and medicine for poor quality or high quality dogs.'
 ""Not only does it provide valuable information, it helps you understand your responsibilities when you decide to administer shots yourself. [substeps] By signing the release form, you accept full responsibility for your pet's injection and any reactions or accident that might occur.""]",C
"[header] How to paint nails like a pro in minutes [title] Pick the right polish. [step] Not all polishes are created equal. Some have potentially harmful chemicals, and others just look downright bad.","['These details are crucial for your nails to have a winning color. The option you select depends on your nail polish hue, color, and particular nail variations (white is best, as is brown/blue of course).'
 'There are a number of things to keep in mind. [substeps] Use a b3f, or "" 3 free "" nail polish and base/top coat.'
 'Choose between : [substeps] Antibiotic with a possible bleaching effect and baking soda and baby powder mix. They contain glycerin and other chemicals used to remove dead skin pores and tear marks as well as minerals and skin gels (onion nudes).'
 'Be careful about how much nail polish you apply to the nails, as nail polish remover is a very dangerous product. Nail polish remover will reduce the amount of the chemicals that are produced in nail polish paint, resulting in a cleaner paint job.']",A
"[header] How to become a legal guardian [title] Decide whether becoming a legal guardian is right for your situation. [step] Guardians are court-supervised caretakers for minors and incapacitated persons. Guardians are responsible for the well-being of their wards (the person for whom they are the guardian), and may also be responsible for handling the person's assets and finances.","['[substeps] Say you and your spouse become court guardians. Both partners should also be qualified for legal guardianship.'
 ""The guardian must periodically report to the court on the ward's status. Make sure that you are prepared to accept the responsibility of acting as a legal guardian.""
 '[substeps] Some states have also broken the statute of limitations for adopting legal guardianship. This means you may not have the time or abilities to take care of a person with mental or physical problems.'
 '[substeps] For example, a ward of a minor (less than 18 years of age) would qualify as legal guardian. A young minor (less than 24 months of age) would qualify under the amendment of the public guardianship act.']",A
"[header] How to encourage your baby to build finger muscles [title] Recognize fine motor skills milestones. [step] From birth, your newborn will have a reflexive ability called the palmar hand reflex. This means that when you put an object into your newborn's palm, it will instinctively wrap its fingers around that object.","['However, after about three to four months, those reflexes go away. You can help encourage your child to develop a palmar hand grasp as the palmar reflex disappears.'
 ""This reflex will help to recognize your baby's abilities during active play, which can include playing in front of the tv or learning to move objects. [substeps] This action is now known as twitch.""
 'Using this reflexive ability, your baby has the ability to get things right. [title] Understand that good experimentation is key to developing finger muscles.'
 ""[substeps] You may also notice that your baby's hands move together as well. This is a sign of enhanced motor skills because they will be able to shape the object.""]",@
"[header] How to dry your painted nails quickly [title] Pick the right clean bowl. [step] You want a deep enough, and large enough, bowl that you can submerge the entire nail into the bowl. Ideally, you want a bowl large enough to dip all of your nails at once.","['You also want your bowl to have a deep enough bowl so you can submerge each nail. [substeps] Check the amount of time that you should soak the nail.'
 '[substeps] Pick a bowl that can stand up to freezing or chilling. Metal bowls will hold in the cold and be cold to the touch.'
 '[title] Fill a plastic water dish about two-thirds full with tap water. [step] Make sure that the bowl is big enough so that you can place every toe and nail before pouring in the water.'
 ""You will be dipping each nail in a shallow bowl (like a frozen basin that you don't have to fill). [substeps] You want to only dip one nail in at a time; otherwise, your nails may not dry evenly.""]",A
"[header] How to apply creme eyeshadow [title] Choose an eyeshadow. [step] Crème eyeshadow can be difficult to apply. While you're getting the hang of it, stick to neutral or nude shades, so you can easily blend in mistakes.","[""Avoid waterproof varieties until you've had some practice. [title] Check the eyeshadow for freshness.""
 'Avoid bold shades, though, and stick to mainly neutral colors. Your eyeshadow is the make up that you put on your face.'
 '[substeps] Try teaspoons or espresso colors if you want a natural look. [title] Blend concealer in the corner of your eye with the liner.'
 'Some eyeshadow colors include : [substeps] Gold, nude, deep red, purple, or reddish. [title] Prime your face and set it with some primer.']",@
"[header] How to score in curling [title] Know how teams are set up. [step] Each game of curling is played with two teams, and each team has four members. [substeps] Each member of the team will throw two stones per end, and each of those stones is played one at a time, not back-to-back.","['A player who strikes first gets to claim points. The player who scored first does not directly draw points.'
 ""The team that's less likely to get those stones in the end will have fewer rounds. The team with the most stones wins the weighted penalty.""
 'The team who throws the biggest stones the farthest wins. [title] Understand the order in which each team stands.'
 'The other players will help direct the stone toward the house. Players will determine their order of rotation before the game and follow that rotation throughout all the ends.']",C
[header] How to dye hair two colors [title] Separate your hair. [step] Brush or comb your hair into two loose pigtails. This will make it easier to wrap in foil after you apply the bleach and the dye.,"['Pin this section of your hair up and leave the bottom section bare. [substeps] Your clothes will be protected from the dye by the foil.'
 ""[title] Find a booth in a room with air circulation. [step] If possible, it's best if you can see the entire workspace, including the counters near the tools and appliances that are often used to collect hair-bleaching products.""
 'Tie an elastic band on each segment to mark the bottom 2/3 of your hair. [title] Bleach the area below the elastic bands.'
 'Put two braids into one pigtails, one near the nape of your neck and the other behind the ears. [substeps] Each braid takes up the space between the twists and the top of your head (called the crown section).']",B
"[header] How to get ready for a party [title] Prepare anything you need to bring. [step] If the party is a potluck, you'll want to make and bring a dish to share. If the party is a birthday party or some kind of shower, you'll need to bring a gift.","['If you are throwing a birthday party or if your parents are fine with it, feel free to bring these items. [substeps] In a party, use sachets or strings to write things in.'
 ""If the party is a dinner party, you should bring a bottle of wine or a hostess gift. At more casual parties in high school or college, it's generally expected that guests won't bring anything unless it's been specified on the invitation.""
 ""You'll also want to bring a good notebook and a pen so you can write down ideas on how to best decorate the house. A classic approach would be to bring plastic utensils, such as wine glasses.""
 ""[title] Know what you're expected to wear. [step] If you're just going to school, you might wear a dress, but if you're doing other things, such as going to a dance, you might wear some pajamas or something a little fancier like a dress.""]",A
"[header] How to grow long, strong nails [title] Stop biting your nails. [step] Biting your nails is detrimental to your health. Although a regular nervous habit for many, it can cause bacterial skin infections on your hands and in your mouth.","[""If you have dry or loose skin around your nail beds, make sure to clip them away rather than biting them off. [substeps] Try keeping your nails neatly polished or add nail art, so you'll be less apt to biting.""
 '[substeps] Make sure to chew your nails for at least 15 seconds before biting. This will help the disease spread to your teeth rather than just your nails.'
 '[substeps] Your immune system is in decline as well. When bitten, your nails can start to break down and become brittle, which causes additional skin damage.'
 'Either stop biting your nails (and the skin around them), or stop biting them entirely when you feel irritated. [substeps] There is debate on whether or not biting your nails can prevent and stop infections from developing.']",@
[header] How to make the most of your money [title] Pack simple lunches instead of eating at restaurants. [step] Sandwiches and bulk snack items will help your food bill drop. Observe your grocery bills to see what foods or other items (e.g. toilet paper and toothpaste) you buy a lot.,"['Reading labels beforehand will allow you to afford small meals more easily. [substeps] If you eat lunch, visit a supermarket to see what items are included in a convenience section, such as fruit, vegetables and meat.'
 ""[substeps] Eat similar foods when you can to save money on gas. [title] Plan lunches that won't make your bills drop.""
 ""Buy these in bulk to save money and gas. [title] Try cheaper, healthier alternative snack items at stores like trader joe's.""
 'To avoid combining any purchases that require a certain amount of money into one meal, put a few simple groceries in a lunch or buy the "" walk me down "" bag with a purse that holds all your food, like mini sandwiches and extra bottles. [substeps] Don\'t be afraid to splurge during grocery shopping.']",B
