question,choices,answer
"[header] How to clean hairbrushes and combs [title] Remove hair from the brush with your fingers. [step] Get as much hair out of the brush or comb first by simply picking it out with your fingers. Hair should come out fairly easily, so try to be as thorough as possible.","[""[substeps] If hair does come out as you use it, you'll need to repeat the same process several times to eliminate hard to reach strands. Take hairbrushes, combs, and brushes out once you've removed your hair from the brush or comb.""
 ""[substeps] If you have any leftover hair lying around, place a sticky towel under your brush to catch any other hair that falls out as you comb. Toss out hair you weren't brushing on a paper towel to be tied later.""
 ""If you encounter any hair that's stuck on, use a toothpick to loosen it and then remove it with your fingers. [title] Mix a mild cleaner with warm water.""
 ""Pay special attention to hairs that you can't reach easily with your fingers alone. [title] Dry with a clean towel when you're done brushing.""]",B
[header] How to clean colored leather [title] Vacuum or shake off loose debris. [step] Use a furniture attachment to remove all extra dirt and debris from your furniture. Be very gentle when vacuuming so you don't scratch the leather.,"['Also, be mindful of the decal. If the decal gets damaged, then your leather may become burnt or discolored.'
 ""It's more safe to vacuum cushions, fan covers, or coffee tables than to completely clean your leather. [title] Choose a vacuum cleaner that will prevent dust from getting into your upholstery.""
 ""Shake dirt into a bucket or wide container. Shake it until you've collected all the dust and debris.""
 'Brush dust and debris off of other leather items, like purses and gloves. [title] Make a basic cleaning solution with mild soap and water.']",C
"[header] How to benefit from interpersonal therapy [title] Talk to your doctor. [step] The decision to use interpersonal therapy should be discussed with your doctor. If you have depression or a similar condition, you may decide to try interpersonal therapy prior to medication, or you may decide to combine medication with the therapy.","['Once you have discussed your concerns, you can decide which therapy approach is right for you. [substeps] Determine if you want to involve a doctor or a therapist in your therapy.'
 'Your doctor will help determine the best treatment for you, and you may begin to feel better after. [substeps] Some people may not feel comfortable using an interpersonal therapy program.'
 '[substeps] Many forms of interpersonal therapy are used to help dependents or people with depression who have highs and lows. Participating in an interpersonal therapy session may help you better understand what to expect.'
 ""[substeps] If you don't already have a therapist or psychologist, ask your doctor for a referral. You can also search online for therapists who treat your mental illness and use interpersonal therapy.""]",C
"[header] How to dry out dirt [title] Clear any debris. [step] Before you add anything to the dirt, you should make sure that all interfering debris has been cleared away from the area. [substeps] If you keep the debris in place, you may work undesirable material into the soil while working in the lime.","['For example, you may be removing plants from the lawn beds that need frequent cleansing. If you have a garden sprayer, extend it towards a hose and squirt the soil around the roots.'
 'If this is the case, you might consider putting a film over the area and digging a hole around the existing debris. You want to clean the area around the unwanted object before you begin working to prevent the object from falling apart.'
 'The presence of surface debris can also cause the soil to retain more moisture by blocking potentially drying sunlight. At minimum, rake away soggy leaves and old mulch to clear the soil.'
 'Gather a blanket or tarp and drape it over the dirt. Drape the blanket or tarp over as much of the stuck-on dirt as possible.']",B
[header] How to create a frequency table with spss predictive analytics software [title] Collect data and create a title for each variable. [step] For this example you want to test the correlation (if any) between an individuals affinity for cats and their overall happiness. [title] Open the spss software.,"['[step] You will need to ask a random selection of people asking for samples of each product they want to make. [title] Enter your product title into the text box.'
 '[step] Click the menu button on the side of the interface and click "" add (variable name) "". A banner will appear that shows add a mouse clicks and click on "" create new page "".'
 '[title] Get a palette of colors and images and start creating the frequency table. [step] These include picture transparencies (red to white, blue, orange to orange) or color/fotocross (red to green, and blue to green, especially if new).'
 '[step] A dialogue box will appear with several different options. Select "" type in data "", this will produce a blank spreadsheet.']",C
[header] How to get healthy looking nails [title] Trim your nails regularly. [step] Use manicure clippers to trim your nails straight across and round the tips with a gentle curve. It's easier to trim your nails after a bath or shower since they are soft and more gentle to clip.,"[""Don't file your nails immediately after exposure to water as this may weaken your nails. [title] Buff your nails for a healthy shine.""
 ""Only clip down on the length of each nail. Don't trim straight across from the tip of your first one; you risk cutting yourself on this.""
 ""[substeps] While you're in the shower, trim back the length of your nails according to your preference. This will give you an extra length for later.""
 'It may also work to file your nails so your nails are less curved. [substeps] To prevent staining your nails, add ice packs to help you keep the ice pack cool.']",@
"[header] How to become a body piercer [title] Make sure that you are a suitable candidate. [step] Before you go forward with your training, first consider whether piercing is the right option for you. [substeps] Body piercers must be at least 18 years old.","['Pregnant women and those over 21 are at no additional risk of developing injuries or diseases. A figure greater than 33 is considered a well-qualified candidate.'
 ""Since piercing is a sport, you must be 16 years old to be a piercer. If you are over the age of 18, you'll need a detailed diagnosis from a pediatrician and a monthly medical history from a doctor.""
 'Body piercers also need to have exceptional hand-eye coordination. If you have unsteady or shaky hands, keep in mind that this could be a hurdle you may be unable to overcome.'
 ""As a responsible candidate, you'll be responsible for paying for the piercing so you know if it's appropriate for you. Generally, large or tightly open piercings are more acceptable than small or uneaten ones.""]",B
"[header] How to clean out a purse [title] Empty your purse on a flat surface. [step] Take all the empty containers, wrappers, or other trash and throw it away. [title] Clean the outside of your purse with warm water.","['[step] Pour around five gallons (2.4 l) of cold water into a 1 quart (92.6 l) cup. Measure out the toothbrush, for example, and place it in the cup.'
 ""[step] Use soap if it won't damage the purse. If the inside is filled with dust or makeup bits, turn the purse upside-down and tap over a sink.""
 '[step] Cleaning out the inside of your purse will ensure it is neat and neat to look at. To do this, fill a bucket with lukewarm water.'
 '[step] Fill up a bucket with warm water, then cover it in your preferred cleaning solution. Add a few drops of dish soap into the water, then swirl the container around until the solution is evenly distributed throughout the inside.']",A
"[header] How to treat seasonal allergies in cats [title] Keep your cats inside when the pollen count is high in your area. [step] Visit an environment or weather related website to check the allergy forecast for your area. If the pollen count is high, you should keep your cat inside.","['Avoiding contact with the cause of the allergy such as pollens, dust mites and molds, is the best treatment for cat allergies. [substeps] You could look up the allergy forecast on the weather network.'
 '[substeps] Pollen count regulations vary by region or city. In certain areas, allergy smoke indoors and outside may be more prevalent, but in others the pollen counts can drop and your neighborhood could become unsafe.'
 'Invoicing a dosage into the local city or state laboratory is not recommended if you suspect allergies. [substeps] Windows are often turned off when pollen counts in the area are high, while indoor shops and parks tend to have low pollen counts.'
 'If the pollen count is lower, keep your cat outside. [substeps] For example, you could check the pollen count by picking up your cat in the morning and putting it in your car, then placing the cat in a carrier or crate.']",@
"[header] How to seam carpet [title] Position the carpet well. [step] You should plan the seam so that it falls out in an area that gets very little foot traffic. For instance, placing it an area that will be underneath furniture is better than placing it in the center of your room.","['[title] Pick up a piece of fabric to put on the seam. [step] The amount of fabric to use is up to your preference.'
 '[substeps] Hiding the seam also makes it less noticeable. Even a good seam may still be seen from time to time, so hiding it will make your room look more professional and neat.'
 '[substeps] Lay out a medium-sized section of your carpet going 45 °. For instance, if you put it on a dining table, it should be under a dining chair.'
 '[substeps] For instance, if your bedrooms are near the kitchen counter, you should place each staple in a corner of each corner. [title] Measure the area where you plan to either put a staple or seam.']",A
"[header] How to swim freestyle [title] Perfect your hand placement and entry. [step] To begin your stroke, your hands should be relaxed and your fingers should be held together. Put your hand into the water fingers first about 15 inches above your head.","['Your palm should be tilted at a 45 degree angle facing out so your index and middle finger enter the water first. Your wrist should be tilted down and positioned above the fingers, and your elbow will be raised above the wrist.'
 'Keep your fingers spread thin and about 30 inches wide to hold your stroke safe. [substeps] Your fingertips should also be far enough apart to incorporate with your other fingers but without gripping them the whole time.'
 ""Then, unclasp your hands from each other, and breathe in and out, to get the water in your body down. You should feel like you're leaning across a puddle, so apply pressure with your fingers.""
 ""Bend your elbow and lower your arm into the water with your palm facing upward, then push your arm away from your body until it's almost directly above your head on a horizontal surface. Your elbow should be in line with your forehead, then you can get out of the water with it.""]",@
"[header] How to make an elastic band "" braid "" [title] Prepare your hair. [step] Brush your hair and spray a little dry shampoo at the roots. [title] Pull your hair into a ponytail.","['[step] The ponytail should be about 1 inch (2.5 cm) high so you will have enough hair to wrap around your wrist at this point. You can also skip braiding and just tie it around your scalp instead.'
 ""[step] It is easier to do this to the side if you are doing your own hair. If you are doing someone else's hair, consider doing it at the back.""
 '[step] Consider braiding in three sections into a neat ponytail. [substeps] If your hair is very coarse use all three sections.'
 '[step] Alternatively, if you have naturally straight hair, use your bangs as an alternative. You can use either a neck scarf or a bandana.']",A
"[header] How to make taco sauce [title] Whisk together the tomato sauce and seasonings. [step] In a medium mixing bowl, whisk together the tomato sauce, chili powder, cumin, garlic powder, onion powder, paprika, cayenne pepper, apple cider vinegar, and honey. Mix until smooth and evenly combined.","['Transfer the mixture to a fine-mesh strainer to stop the ketchup from dripping into the bowl. [substeps] When you are finished, stir the ketchup and tomato mixture together again.'
 '[substeps] The basil seeds in the cayenne pepper, followed by any of the peppers will create the mixture. The peppers have to be finely chopped before mixing them in.'
 '[substeps] Use plain tomato sauce, not tomato sauce previously seasoned with other herbs and spices. Using a flavored tomato sauce can throw off the final taste of the taco sauce.'
 '[title] Add the tomatoes and paprika. [step] In a medium mixing bowl, beat the onions and/or garlic till fully combined and combine.']",B
"[header] How to make clove cigarettes or kretek [title] Gather your looseleaf tobacco and whole cloves. [step] Depending on how much clove you like, you can do a clove: tobacco ratio of anywhere from 1:3 to 2:3. Any more than that and it will not burn properly.","['[title] Buy one clove of whole cloves. [step] Grosgrain is the best one to start with, since the garlic potassium contains magnesium, so if you only use one pod, you will not produce any flavor! [title] Get everyone together in an underground cellar or room.'
 '[title] Cut your cloves at the stem. [step] The main difference between old split and new clip cloves is that they are of the same type.'
 '[title] Start to prepare the cloves for inclusion. [step] A clove is actually a dried flower.'
 '[title] Peel the skin off the cloves. [step] The peel is best done in a pan so that you can heat it up more evenly.']",B
[header] How to put on a loincloth [title] Use leather for a comfortable and durable loincloth. [step] Leather is a common material used in most loincloths. Try using leather for a more durable and traditional loincloth.,"['They provide great protection against the elements and are more and more comfortable. They are long and stick to the lower body, though they can also be added with feathers.'
 ""Cloth looks appropriate compared to other fabrics and also hides some of the body's flaws so you look a bit like that particular man. [substeps] Leather, on average, is a breathable, breathable material (especially when it's slept on).""
 'Cooler areas are probably best, as they do not provide as much material and can be more expensive. However, the lightcloth should be fairly breathable, as it will prevent excessive sweating.'
 'However, leather can be quite warm and is not a very breathable material. Certain leathers can be bought in bulk at various fabric or textile supply stores.']",C
"[header] How to make bananas ripen faster [title] Put the bananas in a paper bag. [step] Bananas produce ethylene gas, a hormone that triggers ripening. Keep them in a paper bag to trap more of this gas near the fruit.","[""Large, unripe bananas are a good bet, as they can continue to produce ethylene gas through ripening. [substeps] One big bowl works well, since large, unripe bananas won't spoil right away.""
 '[substeps] Resist the urge to squeeze the bananas. Wrap the bag lightly with a rubber band or otherwise press them down gently with enough pressure to help them ripen quicker.'
 '[substeps] Avoid paper bags with a clay or waxy coating, which may absorb the ethylene. A plastic bag blocks oxygen from reaching the fruit, which can sometimes lower the production of ethylene.'
 ""Cheesecloth bags produce ethylene gas too, so if you're using cheesecloth bags, place them in a tightly closed bag. If working in a garage, clean immediately.""]",B
"[header] How to get a job as a mortuary makeup artist [title] Spread the word about your services among local business. [step] List your services online and leave business cards at salons that don't have a mortuary makeup artist on staff. Making connections within the community can lead to referrals, individual freelance jobs, or a full-time position.","['Ask if there are any publicly-traded businesses in your area that would be willing to split vacation time with you. [substeps] Most body shops hire large numbers of makeup artists, so you might be able to earn a little extra.'
 ""Be selective and don't neglect to showcase a strong foundation to build a search for jobs. [substeps] If the attraction is for time-sensitive applicants, emphasize it to your clients and let them know how much they mean to you.""
 '[substeps] Keep in mind that there will be more opportunities and higher-paying mortuary makeup artist jobs in highly populated areas. [title] Reach out to funeral homes in your area.'
 '[substeps] Locate a local mortuary makeup artist and ask them to write a hiring letter and share it with prospective employers. Keep in mind that even if you have been hired for a smaller role, employers still may want to hire you again.']",B
"[header] How to look busy even when you're not [title] Take some notes. [step] Jotting down things on a notepad or sticky note can make you look busy in almost any situation. It helps to keep your writing just a bit hard to read, so people don't know what you're actually writing without looking closely at it.","[""[substeps] Some notes on a notepad or sticky note can help. You can store them on a notepad, too, in case your mind gets confused about what you're writing.""
 ""[substeps] Of course, what you're writing doesn't need to be on task. Write a grocery list or the next great novel.""
 '[substeps] Always go on a handwritten note to yourself that is relatively easy to read. You can sometimes forget some of your thoughts if you write before you actually write.'
 '[substeps] Take a sheet of paper and mark notes down for the alarm in case you fall asleep. Write down notes as early as possible in the morning, before everyone else is up.']",A
"[header] How to make chewing gum [title] Heat the ingredients. [step] Place the gum base, corn syrup, glycerine, citric acid and bubble gum flavoring in the top part of a double boiler. Place the double boiler on the stove and turn the burner to medium high.","[""[title] Add the melted gum base mixture to the warm water. [step] Beat the ingredients together one at a time until they're the consistency of peanut butter.""
 'Put the rest of the ingredients except for the sugar back into the boiler and heat them on medium until the sugar is dissolved. [substeps] Stir the gum base often to keep it from scorching.'
 'Stirring occasionally with a spoon, heat the mixture until it becomes warm and gooey. [substeps] You can find gum base, glycerine and citric acid at candy supply stores or online retailers.'
 ""[substeps] There are many ways to do this, but you want to choose a place that is relatively safe, away from heat sources. If you're working in a hot environment, place the ingredients in a glass bowl or bowl and let the ingredients melt for 20 to 30 minutes before proceeding to the next step.""]",B
"[header] How to fold serviettes [title] Recognize different serviette sizes. [step] Serviettes come in a variety of sizes for different meals and functions. Aside from a few specific napkin types, serviettes are almost always perfect squares.","['Cocktail napkins are generally too small to fold, but most other napkins will be large enough for most fancy serviette folds. [substeps] Cocktail napkins are usually six to 9 inches square (15 to 23 cm).'
 'Here are some examples of serviettes : [substeps] A square is a square with either hexagonal or rectangles inside. This means there is about 8 corners inside the square.'
 'Both serviettes and servings should be spaced evenly apart. [substeps] For example, a square of 2 with a quarter-inch seam allowance of 1/2 an inch and 2 with a slit allowance of 2/4 inch equals 1 square of 1/8 an inch.'
 'Be sure to check the size and shape of your table cloth before choosing one for every table you choose. [substeps] For the most accurate measurement, begin by measuring the width and form of the square.']",@
[header] How to do hairstyles with a twisty bump [title] Brush your hair. [step] Brush gently to remove all tangles. Part your hair as usual.,"['Tease the top section of your hair next and pin the bottom section into place. Smooth out any flyaways and a bit of the top section of your hair.'
 ""[substeps] If you have long or wavy hair, keep a very fine strand of your hair forward at all times so it doesn't tangle. You can make this part as short or longer as you want.""
 '[title] Gather your hair into a front part. [step] This will be known as a bump-bob style.'
 'The fewer tangles in your hair, the neater the look turns out. [title] Twist a small front section of hair.']",C
"[header] How to care for straight hair [title] Shampoo and condition medium-to-thick straight hair 2-3 times per week. [step] Naturally straight hair that has a medium or thick texture can be shampooed 2-3 times per week, or every other day if you're very active. [substeps] Use a regular or hydrating shampoo, or shampoo for color-treated hair if you use color in your hair.","[""For curly hair, use a clarifying shampoo that includes sulfates. If you're under the age of 20 and have hair that's already dyed blonde, skip this step.""
 '[title] Comb and condition your hair once or twice a week. [step] Thinning hair can cause hair to age a lot faster, so regular regular brushing can help your hair grow out a bit more.'
 ""[title] Shampoo naturally fine, straight hair every day if it's oily. [step] A drawback of naturally straight, fine hair is that it can become oily quickly.""
 'Using a treatment formulated specifically for curly hair will make the shampoo more hydrating. If you have curly hair, try shampooing a few times per week in the morning or evening.']",B
"[header] How to remove splat hair color [title] Crush 6 vitamin c tablets into a fine powder. [step] Put the tablets into a plastic bag, then seal the bag and place it on a cutting board. Use a rolling pin or hammer to crush the tablets into a powder consistency.","['Scrape out any extra lumps and dust the powder out. [substeps] Store the powder in an airtight container or in the refrigerator for 3-6 months.'
 'You can also add an aspirin and mint to help with the crunch. [substeps] After crushing the tablets, you can place the powders in a food processor.'
 'Keep crushing until all of the large granules have been broken down. [title] Mix the vitamin c with 1/4-1/2 cup (60-120 ml) of anti-dandruff shampoo.'
 'You should crush only about 20 tablets to a coarse powder. If you are using whole tablets, crush 2 pills to make 1 tablespoon of powder.']",B
"[header] How to apply for unemployment in texas [title] Meet threshold income requirements. [step] Texas, like other states, requires that you meet a certain minimum taxable income in order to qualify for unemployment benefits. They will look at the first 4 of the last 5 quarters as a "" base period.","['"" in this case, your maximum income is $99 , 250. [substeps] Other taxes that are required for unemployed individuals include housework, student loans, wages, mortgages, sick days, and spousal support.'
 '"" essentially, then, you must have made at least a minimum income for the full year preceding the last quarter, before you applied for benefits. [substeps] If you do not have enough taxable wages from employment in the base period, you aren\'t eligible for unemployment benefits.'
 '"" [substeps] You will be required to be at least 65 years of age. Income earned in payroll may be supported by employment for a limited period.'
 '"" but you must be over the age of 40 years old and under the age of 25 before you qualify for benefits. [substeps] If you do not meet the minimum taxable income requirements, or if your income is too insufficient, you will need to seek help from your family to start the process.']",A
"[header] How to wear brogues [title] Go with full brogue shoes for a detailed, fancy footwear option. [step] Full brogues have a pointed toe cap and extending lines or "" wingtips "" that run along both sides of the shoe. They have perforations in the leather across the edges, and many styles also have decorative holes on the center of the toe cap (called the "" medallion "").","['[substeps] From above, the cap shape looks like a "" w, "" which is why they are also called wingtips. Full brogues are best styled with professional outfits.'
 '[substeps] When wearing colored brogues, color-issued shoes are often added as a wide-brimmed hat because the toe cap is a shoulder-cap. [title] Wear bright toe pads for a casual look.'
 'The plastic ligaments on the inner sides of the shoes are tucked into the toe caps to ensure your toe cap will fit right in. [title] Choose crop tops or cotton-lined dresses for formal styles.'
 'These do not carry as much wear on the one end of the shoe. Still, a good footwear of black or brown is important.']",@
